{
  "schema_version": "1.0",
  "company_slug": "example",
  "period": "2024-01",
  "base_currency": "EUR",
  "generated_at": "2026-04-04T00:00:00Z",
  "sources": [],
  "records": {
    "sales": [],
    "refunds": [],
    "fees": [],
    "payouts": [],
    "bank_transactions": [],
    "clearing_transactions": [],
    "bank_balances": [],
    "purchase_expenses": [],
    "purchase_credits": [],
    "inventory_movements": [],
    "manual_adjustments": [],
    "other": []
  },
  "exceptions": []
}
